{
  "id": "AP-SCEN-041",
  "title": "Benefits eligibility reduction without notice proof",
  "domain": "public_sector",
  "risk_tier": "high-consequence",
  "action_type": "benefits_update",
  "protected_system": "public benefits system",
  "scenario": "An agent reduces eligibility but cannot show current notice and appeal preconditions.",
  "acceptance_boundary": "before record update",
  "public_evidence_categories": [
    "action",
    "actor",
    "delegation",
    "scope",
    "target",
    "runtime_or_environment",
    "policy_state",
    "freshness",
    "revocation",
    "replay_or_duplicate",
    "consequence",
    "decision_reason"
  ],
  "expected_decision": "HOLD",
  "why": "Required procedural evidence is incomplete.",
  "human_impact": "Helps prevent autonomous action from becoming real-world harm without sufficient current, scoped evidence.",
  "learning_goal": "Practice separating access, authority, protected execution, and action acceptance before impact.",
  "rights_boundary": "Public educational scenario only. Not a conformance test vector, certification artifact, implementation disclosure, or patent license."
}
