{
  "id": "AP-SCEN-009",
  "title": "Feature flag rollout to protected cohort",
  "domain": "cloud_deployment",
  "risk_tier": "high-consequence",
  "action_type": "feature_flag",
  "protected_system": "customer-facing feature flag service",
  "scenario": "An agent attempts to enable a feature for a regulated customer cohort not named in the approval.",
  "acceptance_boundary": "before flag update",
  "public_evidence_categories": [
    "action",
    "actor",
    "delegation",
    "scope",
    "target",
    "runtime_or_environment",
    "policy_state",
    "freshness",
    "revocation",
    "replay_or_duplicate",
    "consequence",
    "decision_reason"
  ],
  "expected_decision": "REFUSE",
  "why": "Scope mismatch against protected cohort.",
  "human_impact": "Helps prevent autonomous action from becoming real-world harm without sufficient current, scoped evidence.",
  "learning_goal": "Practice separating access, authority, protected execution, and action acceptance before impact.",
  "rights_boundary": "Public educational scenario only. Not a conformance test vector, certification artifact, implementation disclosure, or patent license."
}
