{
  "id": "AP-SCEN-014",
  "title": "Confidential summary with missing audience binding",
  "domain": "enterprise_data",
  "risk_tier": "high-consequence",
  "action_type": "summarization",
  "protected_system": "confidential project repository",
  "scenario": "An agent prepares a summary but the audience is not bound to the authorization record.",
  "acceptance_boundary": "before summary is sent",
  "public_evidence_categories": [
    "action",
    "actor",
    "delegation",
    "scope",
    "target",
    "runtime_or_environment",
    "policy_state",
    "freshness",
    "revocation",
    "replay_or_duplicate",
    "consequence",
    "decision_reason"
  ],
  "expected_decision": "HOLD",
  "why": "Audience proof is incomplete.",
  "human_impact": "Helps prevent autonomous action from becoming real-world harm without sufficient current, scoped evidence.",
  "learning_goal": "Practice separating access, authority, protected execution, and action acceptance before impact.",
  "rights_boundary": "Public educational scenario only. Not a conformance test vector, certification artifact, implementation disclosure, or patent license."
}
