{
  "id": "AP-SCEN-100",
  "title": "Social post using sensitive context",
  "domain": "agent_tool_use",
  "risk_tier": "high-consequence",
  "action_type": "social_post",
  "protected_system": "social media account",
  "scenario": "An agent drafts a post from private context and attempts to publish it publicly.",
  "acceptance_boundary": "before publication",
  "public_evidence_categories": [
    "action",
    "actor",
    "delegation",
    "scope",
    "target",
    "runtime_or_environment",
    "policy_state",
    "freshness",
    "revocation",
    "replay_or_duplicate",
    "consequence",
    "decision_reason"
  ],
  "expected_decision": "HOLD",
  "why": "Public release requires explicit confirmation.",
  "human_impact": "Helps prevent autonomous action from becoming real-world harm without sufficient current, scoped evidence.",
  "learning_goal": "Practice separating access, authority, protected execution, and action acceptance before impact.",
  "rights_boundary": "Public educational scenario only. Not a conformance test vector, certification artifact, implementation disclosure, or patent license."
}
