{
  "id": "AP-SCEN-091",
  "title": "Email send after draft approval",
  "domain": "agent_tool_use",
  "risk_tier": "context-dependent",
  "action_type": "email_send",
  "protected_system": "corporate email",
  "scenario": "An agent sends an email exactly matching an approved draft to the approved recipient.",
  "acceptance_boundary": "before send",
  "public_evidence_categories": [
    "action",
    "actor",
    "delegation",
    "scope",
    "target",
    "runtime_or_environment",
    "policy_state",
    "freshness",
    "revocation",
    "replay_or_duplicate",
    "consequence",
    "decision_reason"
  ],
  "expected_decision": "ACCEPT",
  "why": "Recipient and content scope match.",
  "human_impact": "Helps prevent autonomous action from becoming real-world harm without sufficient current, scoped evidence.",
  "learning_goal": "Practice separating access, authority, protected execution, and action acceptance before impact.",
  "rights_boundary": "Public educational scenario only. Not a conformance test vector, certification artifact, implementation disclosure, or patent license."
}
