{
  "id": "AP-SCEN-050",
  "title": "Immigration case note external sharing",
  "domain": "public_sector",
  "risk_tier": "high-consequence",
  "action_type": "case_note_share",
  "protected_system": "secure case system",
  "scenario": "An agent shares a sensitive case note with an external workflow not authorized for the person.",
  "acceptance_boundary": "before share",
  "public_evidence_categories": [
    "action",
    "actor",
    "delegation",
    "scope",
    "target",
    "runtime_or_environment",
    "policy_state",
    "freshness",
    "revocation",
    "replay_or_duplicate",
    "consequence",
    "decision_reason"
  ],
  "expected_decision": "REFUSE",
  "why": "Destination and authority fail.",
  "human_impact": "Helps prevent autonomous action from becoming real-world harm without sufficient current, scoped evidence.",
  "learning_goal": "Practice separating access, authority, protected execution, and action acceptance before impact.",
  "rights_boundary": "Public educational scenario only. Not a conformance test vector, certification artifact, implementation disclosure, or patent license."
}
