{
  "id": "AP-SCEN-068",
  "title": "Accessibility label for verified overlay",
  "domain": "ar_vr_overlays",
  "risk_tier": "context-dependent",
  "action_type": "accessibility_label",
  "protected_system": "assistive display pipeline",
  "scenario": "A verified overlay includes a machine-readable accessibility label.",
  "acceptance_boundary": "before display",
  "public_evidence_categories": [
    "action",
    "actor",
    "delegation",
    "scope",
    "target",
    "runtime_or_environment",
    "policy_state",
    "freshness",
    "revocation",
    "replay_or_duplicate",
    "consequence",
    "decision_reason"
  ],
  "expected_decision": "ACCEPT",
  "why": "Label supports accessibility and transparency.",
  "human_impact": "Helps prevent autonomous action from becoming real-world harm without sufficient current, scoped evidence.",
  "learning_goal": "Practice separating access, authority, protected execution, and action acceptance before impact.",
  "rights_boundary": "Public educational scenario only. Not a conformance test vector, certification artifact, implementation disclosure, or patent license."
}
