{
  "id": "AP-SCEN-001",
  "title": "Production deployment after approval window expired",
  "domain": "cloud_deployment",
  "risk_tier": "high-consequence",
  "action_type": "production_deploy",
  "protected_system": "production Kubernetes cluster",
  "scenario": "An agent generated a valid deployment plan, but the approval window expired before the apply step.",
  "acceptance_boundary": "before deployment is applied to production",
  "public_evidence_categories": [
    "action",
    "actor",
    "delegation",
    "scope",
    "target",
    "runtime_or_environment",
    "policy_state",
    "freshness",
    "revocation",
    "replay_or_duplicate",
    "consequence",
    "decision_reason"
  ],
  "expected_decision": "HOLD",
  "why": "Current approval is incomplete or stale.",
  "human_impact": "Helps prevent autonomous action from becoming real-world harm without sufficient current, scoped evidence.",
  "learning_goal": "Practice separating access, authority, protected execution, and action acceptance before impact.",
  "rights_boundary": "Public educational scenario only. Not a conformance test vector, certification artifact, implementation disclosure, or patent license."
}
