{
  "id": "AP-SCEN-048",
  "title": "Public comment summary release",
  "domain": "public_sector",
  "risk_tier": "high-consequence",
  "action_type": "summary_release",
  "protected_system": "public records portal",
  "scenario": "An agent releases a public summary derived only from comments already marked public.",
  "acceptance_boundary": "before publication",
  "public_evidence_categories": [
    "action",
    "actor",
    "delegation",
    "scope",
    "target",
    "runtime_or_environment",
    "policy_state",
    "freshness",
    "revocation",
    "replay_or_duplicate",
    "consequence",
    "decision_reason"
  ],
  "expected_decision": "ACCEPT",
  "why": "Scope and data classification support release.",
  "human_impact": "Helps prevent autonomous action from becoming real-world harm without sufficient current, scoped evidence.",
  "learning_goal": "Practice separating access, authority, protected execution, and action acceptance before impact.",
  "rights_boundary": "Public educational scenario only. Not a conformance test vector, certification artifact, implementation disclosure, or patent license."
}
