{
  "id": "AP-SCEN-088",
  "title": "Grid control setpoint within emergency plan",
  "domain": "robotics_physical",
  "risk_tier": "high-consequence",
  "action_type": "grid_setpoint",
  "protected_system": "energy control system",
  "scenario": "An agent adjusts a grid setpoint under active emergency plan and bounded authority.",
  "acceptance_boundary": "before setpoint commit",
  "public_evidence_categories": [
    "action",
    "actor",
    "delegation",
    "scope",
    "target",
    "runtime_or_environment",
    "policy_state",
    "freshness",
    "revocation",
    "replay_or_duplicate",
    "consequence",
    "decision_reason"
  ],
  "expected_decision": "ACCEPT",
  "why": "Current emergency scope supports action.",
  "human_impact": "Helps prevent autonomous action from becoming real-world harm without sufficient current, scoped evidence.",
  "learning_goal": "Practice separating access, authority, protected execution, and action acceptance before impact.",
  "rights_boundary": "Public educational scenario only. Not a conformance test vector, certification artifact, implementation disclosure, or patent license."
}
