{
  "id": "AP-SCEN-097",
  "title": "Password manager export",
  "domain": "agent_tool_use",
  "risk_tier": "high-consequence",
  "action_type": "credential_export",
  "protected_system": "password manager",
  "scenario": "An agent exports credentials to a new tool without explicit destination approval.",
  "acceptance_boundary": "before export",
  "public_evidence_categories": [
    "action",
    "actor",
    "delegation",
    "scope",
    "target",
    "runtime_or_environment",
    "policy_state",
    "freshness",
    "revocation",
    "replay_or_duplicate",
    "consequence",
    "decision_reason"
  ],
  "expected_decision": "REFUSE",
  "why": "Sensitive egress outside scope.",
  "human_impact": "Helps prevent autonomous action from becoming real-world harm without sufficient current, scoped evidence.",
  "learning_goal": "Practice separating access, authority, protected execution, and action acceptance before impact.",
  "rights_boundary": "Public educational scenario only. Not a conformance test vector, certification artifact, implementation disclosure, or patent license."
}
