{
  "id": "AP-SCEN-055",
  "title": "Minor image use in promotional overlay",
  "domain": "education_minors",
  "risk_tier": "high-consequence",
  "action_type": "image_use",
  "protected_system": "school media system",
  "scenario": "An agent creates a promotional overlay using a minor likeness without current consent evidence.",
  "acceptance_boundary": "before rendering or publishing",
  "public_evidence_categories": [
    "action",
    "actor",
    "delegation",
    "scope",
    "target",
    "runtime_or_environment",
    "policy_state",
    "freshness",
    "revocation",
    "replay_or_duplicate",
    "consequence",
    "decision_reason"
  ],
  "expected_decision": "REFUSE",
  "why": "Consent proof fails.",
  "human_impact": "Helps prevent autonomous action from becoming real-world harm without sufficient current, scoped evidence.",
  "learning_goal": "Practice separating access, authority, protected execution, and action acceptance before impact.",
  "rights_boundary": "Public educational scenario only. Not a conformance test vector, certification artifact, implementation disclosure, or patent license."
}
