{
  "id": "AP-SCEN-033",
  "title": "Account freeze release without fraud review",
  "domain": "financial_actions",
  "risk_tier": "high-consequence",
  "action_type": "fraud_hold_release",
  "protected_system": "bank account system",
  "scenario": "An agent releases a fraud hold because a customer asked, but required fraud review is missing.",
  "acceptance_boundary": "before hold release",
  "public_evidence_categories": [
    "action",
    "actor",
    "delegation",
    "scope",
    "target",
    "runtime_or_environment",
    "policy_state",
    "freshness",
    "revocation",
    "replay_or_duplicate",
    "consequence",
    "decision_reason"
  ],
  "expected_decision": "REFUSE",
  "why": "Required approval proof fails.",
  "human_impact": "Helps prevent autonomous action from becoming real-world harm without sufficient current, scoped evidence.",
  "learning_goal": "Practice separating access, authority, protected execution, and action acceptance before impact.",
  "rights_boundary": "Public educational scenario only. Not a conformance test vector, certification artifact, implementation disclosure, or patent license."
}
