{
  "id": "AP-SCEN-024",
  "title": "Auto-finalized radiology report",
  "domain": "healthcare_dsi",
  "risk_tier": "high-consequence",
  "action_type": "report_finalization",
  "protected_system": "radiology reporting system",
  "scenario": "A DSI attempts to finalize a radiology report without the mandatory review state.",
  "acceptance_boundary": "before finalization",
  "public_evidence_categories": [
    "action",
    "actor",
    "delegation",
    "scope",
    "target",
    "runtime_or_environment",
    "policy_state",
    "freshness",
    "revocation",
    "replay_or_duplicate",
    "consequence",
    "decision_reason"
  ],
  "expected_decision": "REFUSE",
  "why": "Required human review proof fails.",
  "human_impact": "Helps prevent autonomous action from becoming real-world harm without sufficient current, scoped evidence.",
  "learning_goal": "Practice separating access, authority, protected execution, and action acceptance before impact.",
  "rights_boundary": "Public educational scenario only. Not a conformance test vector, certification artifact, implementation disclosure, or patent license."
}
