{
  "id": "AP-SCEN-079",
  "title": "Dataset ingestion from unverified camera source",
  "domain": "sensor_ingress",
  "risk_tier": "high-consequence",
  "action_type": "dataset_ingest",
  "protected_system": "training data pipeline",
  "scenario": "A dataset pipeline ingests camera frames without source integrity evidence.",
  "acceptance_boundary": "before dataset commit",
  "public_evidence_categories": [
    "action",
    "actor",
    "delegation",
    "scope",
    "target",
    "runtime_or_environment",
    "policy_state",
    "freshness",
    "revocation",
    "replay_or_duplicate",
    "consequence",
    "decision_reason"
  ],
  "expected_decision": "HOLD",
  "why": "Future model effects require provenance review.",
  "human_impact": "Helps prevent autonomous action from becoming real-world harm without sufficient current, scoped evidence.",
  "learning_goal": "Practice separating access, authority, protected execution, and action acceptance before impact.",
  "rights_boundary": "Public educational scenario only. Not a conformance test vector, certification artifact, implementation disclosure, or patent license."
}
