{
  "id": "AP-SCEN-035",
  "title": "Chargeback response with current case authority",
  "domain": "financial_actions",
  "risk_tier": "high-consequence",
  "action_type": "chargeback_response",
  "protected_system": "dispute management system",
  "scenario": "An agent submits a response for the named case within current authority and deadline.",
  "acceptance_boundary": "before submission",
  "public_evidence_categories": [
    "action",
    "actor",
    "delegation",
    "scope",
    "target",
    "runtime_or_environment",
    "policy_state",
    "freshness",
    "revocation",
    "replay_or_duplicate",
    "consequence",
    "decision_reason"
  ],
  "expected_decision": "ACCEPT",
  "why": "Current case scope and authority match.",
  "human_impact": "Helps prevent autonomous action from becoming real-world harm without sufficient current, scoped evidence.",
  "learning_goal": "Practice separating access, authority, protected execution, and action acceptance before impact.",
  "rights_boundary": "Public educational scenario only. Not a conformance test vector, certification artifact, implementation disclosure, or patent license."
}
