{
  "id": "AP-SCEN-010",
  "title": "Emergency firewall rule with active incident approval",
  "domain": "cloud_deployment",
  "risk_tier": "context-dependent",
  "action_type": "network_rule_change",
  "protected_system": "production firewall",
  "scenario": "An incident agent applies a temporary deny rule exactly matching active incident approval and expiry.",
  "acceptance_boundary": "before firewall commit",
  "public_evidence_categories": [
    "action",
    "actor",
    "delegation",
    "scope",
    "target",
    "runtime_or_environment",
    "policy_state",
    "freshness",
    "revocation",
    "replay_or_duplicate",
    "consequence",
    "decision_reason"
  ],
  "expected_decision": "ACCEPT",
  "why": "Bounded emergency approval is current and scoped.",
  "human_impact": "Helps prevent autonomous action from becoming real-world harm without sufficient current, scoped evidence.",
  "learning_goal": "Practice separating access, authority, protected execution, and action acceptance before impact.",
  "rights_boundary": "Public educational scenario only. Not a conformance test vector, certification artifact, implementation disclosure, or patent license."
}
