{
  "id": "AP-SCEN-051",
  "title": "Student record export to tutoring vendor",
  "domain": "education_minors",
  "risk_tier": "high-consequence",
  "action_type": "student_data_export",
  "protected_system": "student information system",
  "scenario": "A tutoring agent exports student records to a vendor not covered by the district agreement.",
  "acceptance_boundary": "before data export",
  "public_evidence_categories": [
    "action",
    "actor",
    "delegation",
    "scope",
    "target",
    "runtime_or_environment",
    "policy_state",
    "freshness",
    "revocation",
    "replay_or_duplicate",
    "consequence",
    "decision_reason"
  ],
  "expected_decision": "REFUSE",
  "why": "Destination not authorized.",
  "human_impact": "Helps prevent autonomous action from becoming real-world harm without sufficient current, scoped evidence.",
  "learning_goal": "Practice separating access, authority, protected execution, and action acceptance before impact.",
  "rights_boundary": "Public educational scenario only. Not a conformance test vector, certification artifact, implementation disclosure, or patent license."
}
