{
  "id": "AP-SCEN-023",
  "title": "Dosage recommendation after allergy record update",
  "domain": "healthcare_dsi",
  "risk_tier": "high-consequence",
  "action_type": "medication_recommendation",
  "protected_system": "medication ordering workflow",
  "scenario": "An agent generated a dosage suggestion before a new allergy was recorded.",
  "acceptance_boundary": "before recommendation is finalized",
  "public_evidence_categories": [
    "action",
    "actor",
    "delegation",
    "scope",
    "target",
    "runtime_or_environment",
    "policy_state",
    "freshness",
    "revocation",
    "replay_or_duplicate",
    "consequence",
    "decision_reason"
  ],
  "expected_decision": "HOLD",
  "why": "Clinical context may be stale.",
  "human_impact": "Helps prevent autonomous action from becoming real-world harm without sufficient current, scoped evidence.",
  "learning_goal": "Practice separating access, authority, protected execution, and action acceptance before impact.",
  "rights_boundary": "Public educational scenario only. Not a conformance test vector, certification artifact, implementation disclosure, or patent license."
}
