{
  "id": "AP-SCEN-038",
  "title": "Aml filing with approved analyst confirmation",
  "domain": "financial_actions",
  "risk_tier": "high-consequence",
  "action_type": "regulatory_filing",
  "protected_system": "compliance reporting system",
  "scenario": "An agent submits a regulatory filing after an analyst confirms the exact case and report type.",
  "acceptance_boundary": "before filing submission",
  "public_evidence_categories": [
    "action",
    "actor",
    "delegation",
    "scope",
    "target",
    "runtime_or_environment",
    "policy_state",
    "freshness",
    "revocation",
    "replay_or_duplicate",
    "consequence",
    "decision_reason"
  ],
  "expected_decision": "ACCEPT",
  "why": "Confirmation and target are bound.",
  "human_impact": "Helps prevent autonomous action from becoming real-world harm without sufficient current, scoped evidence.",
  "learning_goal": "Practice separating access, authority, protected execution, and action acceptance before impact.",
  "rights_boundary": "Public educational scenario only. Not a conformance test vector, certification artifact, implementation disclosure, or patent license."
}
